id,headline,content,date
sports-1,Lakers Secure Historic Trade for Three-Time MVP in Blockbuster Deal,"The Los Angeles Lakers completed a stunning trade acquiring Marcus Thompson from the Denver Nuggets in exchange for four first-round picks and two starters. Thompson led the league in scoring last season with 31.5 points per game. The trade instantly makes the Lakers championship favorites.",2026-01-03
sports-2,FIFA Announces Expansion of World Cup to 64 Teams Starting 2030,"FIFA confirmed the World Cup will expand from 48 to 64 teams beginning with the 2030 tournament. The decision aims to increase global football participation and revenue opportunities. Critics argue the expansion will dilute competition quality.",2026-01-07
sports-3,Serena Williams Announces Comeback at Australian Open 2026,"Tennis legend Serena Williams shocked the sports world by announcing her return to professional tennis at age 44. Williams has been training secretly for six months and will compete in the Australian Open. She aims to surpass Margaret Court's record of 24 Grand Slam singles titles.",2026-01-10
sports-4,NFL Approves Private Equity Investment in Team Ownership,"NFL owners voted to allow private equity firms to acquire up to 10% stakes in franchises. The historic decision opens the door for billions in new investment capital. Several teams are already in discussions with major investment groups.",2026-01-14
sports-5,Manchester United Completes Record-Breaking $350 Million Player Transfer,"Manchester United signed Brazilian sensation Rafael Santos from Santos FC for a world-record transfer fee of $350 million. The 19-year-old forward scored 47 goals in all competitions last season. Santos has been compared to a young Ronaldinho by scouts and coaches.",2026-01-19
